{
  "created_at": "2026-10-08T10:18:23.365029Z",
  "definition": {
    "base": {
      "digest": "sha256:1d2cf2b7d715b5b3aa959f0150ccbcc7b71e0181b637e443abf40a7fb56bf79a",
      "tag": "docker.io/library/php:8.4-cli-trixie"
    },
    "capabilities": [
      "php",
      "composer",
      "symfony",
      "postgresql-client",
      "native-build",
      "xdebug"
    ],
    "changes": [
      "Add opt-in trust for a mounted proxy CA before dropping privileges; preserve workspace ownership."
    ],
    "companions": [
      "postgres:17-trixie",
      "redis:7.4"
    ],
    "execution": {
      "cache_paths": [
        "/home/dev/.cache"
      ],
      "default_gid": 1000,
      "default_uid": 1000,
      "gid_env": "PGID",
      "home": "/home/dev",
      "uid_env": "PUID",
      "workspace": "/workspace"
    },
    "extensions": [
      "intl",
      "mbstring",
      "curl",
      "zip",
      "bcmath",
      "dom",
      "xml",
      "pdo_pgsql",
      "pgsql",
      "pdo_mysql",
      "mysqli",
      "pdo_sqlite",
      "gd",
      "redis",
      "sockets",
      "pcntl",
      "xdebug"
    ],
    "family": "php-dev",
    "limitations": [
      "Project PHP dependencies come from Composer lockfiles.",
      "Xdebug is off by default; enable with XDEBUG_MODE=coverage or debug.",
      "No PHP-FPM, web server daemon, or Node toolchain is supplied."
    ],
    "line": "8.4-trixie",
    "line_id": "php-dev/8.4-trixie",
    "migration": "Compatible additive update. Mount one PEM certificate read-only and set LIBRARY_CA_FILE to its container path when needed. Root-owned workspaces can use PUID=0 and PGID=0 without bypassing the entrypoint.",
    "os": "debian-trixie",
    "platforms": [
      "linux/amd64"
    ],
    "purpose": "Loaded PHP and Symfony development, CLI tasks, unit and PostgreSQL integration tests.",
    "revision": "1.1.0",
    "runtime_line": "8.4",
    "schema_version": 1,
    "tools": [
      "bash",
      "git",
      "gh",
      "curl",
      "jq",
      "rg",
      "psql"
    ]
  },
  "input_fingerprint": "060245885e575a9422244437a15ce635463fd2f33248edc21aba11409b64320c",
  "lifecycle": "available",
  "line_id": "php-dev/8.4-trixie",
  "platforms": [
    {
      "digest": "sha256:d3f9483df7c3f30837dab772acaa53f55ab1af5b7bdb21af8d320d80f4bd9029",
      "inventory": {
        "extensions": {
          "bcmath": "8.4.26",
          "core": "8.4.26",
          "ctype": "8.4.26",
          "curl": "8.4.26",
          "date": "8.4.26",
          "dom": "20031129",
          "fileinfo": "8.4.26",
          "filter": "8.4.26",
          "gd": "8.4.26",
          "hash": "8.4.26",
          "iconv": "8.4.26",
          "intl": "8.4.26",
          "json": "8.4.26",
          "libxml": "8.4.26",
          "mbstring": "8.4.26",
          "mysqli": "8.4.26",
          "mysqlnd": "mysqlnd 8.4.26",
          "openssl": "8.4.26",
          "pcntl": "8.4.26",
          "pcre": "8.4.26",
          "pdo": "8.4.26",
          "pdo_mysql": "8.4.26",
          "pdo_pgsql": "8.4.26",
          "pdo_sqlite": "8.4.26",
          "pgsql": "8.4.26",
          "phar": "8.4.26",
          "posix": "8.4.26",
          "random": "8.4.26",
          "readline": "8.4.26",
          "redis": "6.3.0",
          "reflection": "8.4.26",
          "session": "8.4.26",
          "simplexml": "8.4.26",
          "sockets": "8.4.26",
          "sodium": "8.4.26",
          "spl": "8.4.26",
          "sqlite3": "8.4.26",
          "standard": "8.4.26",
          "tokenizer": "8.4.26",
          "xdebug": "3.5.3",
          "xml": "8.4.26",
          "xmlreader": "8.4.26",
          "xmlwriter": "8.4.26",
          "zend opcache": "8.4.26",
          "zip": "1.22.8",
          "zlib": "8.4.26"
        },
        "os": {
          "BUG_REPORT_URL": "https://bugs.debian.org/",
          "DEBIAN_VERSION_FULL": "13.7",
          "HOME_URL": "https://www.debian.org/",
          "ID": "debian",
          "NAME": "Debian GNU/Linux",
          "PRETTY_NAME": "Debian GNU/Linux 13 (trixie)",
          "SUPPORT_URL": "https://www.debian.org/support",
          "VERSION": "13 (trixie)",
          "VERSION_CODENAME": "trixie",
          "VERSION_ID": "13"
        },
        "packages": [
          "adduser=3.152",
          "apt=3.0.3",
          "autoconf=2.72-3.1",
          "base-files=13.8+deb13u7",
          "base-passwd=3.6.7",
          "bash=5.2.37-2+b10",
          "binutils=2.44-3",
          "binutils-common=2.44-3",
          "binutils-x86-64-linux-gnu=2.44-3",
          "bsdutils=1:2.41.5-0+deb13u1",
          "build-essential=12.12",
          "bzip2=1.0.8-6",
          "ca-certificates=20250419",
          "comerr-dev=2.1-1.47.2-3+b12",
          "coreutils=9.7-3",
          "cpp=4:14.2.0-1",
          "cpp-14=14.2.0-19",
          "cpp-14-x86-64-linux-gnu=14.2.0-19",
          "cpp-x86-64-linux-gnu=4:14.2.0-1",
          "curl=8.14.1-2+deb13u5",
          "dash=0.5.12-12",
          "debconf=1.5.91",
          "debian-archive-keyring=2025.1",
          "debianutils=5.23.2",
          "default-mysql-client=1.1.1",
          "diffutils=1:3.10-4",
          "dpkg=1.22.22",
          "dpkg-dev=1.22.22",
          "file=1:5.46-5",
          "findutils=4.10.0-3",
          "g++=4:14.2.0-1",
          "g++-14=14.2.0-19",
          "g++-14-x86-64-linux-gnu=14.2.0-19",
          "g++-x86-64-linux-gnu=4:14.2.0-1",
          "gcc=4:14.2.0-1",
          "gcc-14=14.2.0-19",
          "gcc-14-base=14.2.0-19",
          "gcc-14-x86-64-linux-gnu=14.2.0-19",
          "gcc-x86-64-linux-gnu=4:14.2.0-1",
          "gh=2.46.0-3",
          "git=1:2.47.3-0+deb13u1",
          "git-man=1:2.47.3-0+deb13u1",
          "gosu=1.17-3+b4",
          "grep=3.11-4",
          "gzip=1.13-1+deb13u1",
          "hostname=3.25",
          "icu-devtools=76.1-4",
          "init-system-helpers=1.69~deb13u1",
          "jq=1.7.1-6+deb13u4",
          "krb5-multidev=1.21.3-5+deb13u1",
          "libacl1=2.3.2-2+b1",
          "libapt-pkg7.0=3.0.3",
          "libargon2-1=0~20190702+dfsg-4+b2",
          "libasan8=14.2.0-19",
          "libatomic1=14.2.0-19",
          "libattr1=1:2.5.2-3",
          "libaudit-common=1:4.0.2-2+deb13u1",
          "libaudit1=1:4.0.2-2+deb13u1",
          "libbinutils=2.44-3",
          "libblkid1=2.41.5-0+deb13u1",
          "libbrotli-dev=1.1.0-2+b7",
          "libbrotli1=1.1.0-2+b7",
          "libbsd0=0.12.2-2",
          "libbz2-1.0=1.0.8-6",
          "libbz2-dev=1.0.8-6",
          "libc-bin=2.41-12+deb13u4",
          "libc-dev-bin=2.41-12+deb13u4",
          "libc6=2.41-12+deb13u4",
          "libc6-dev=2.41-12+deb13u4",
          "libcap-ng0=0.8.5-4+b1",
          "libcap2=1:2.75-10+deb13u1+b3",
          "libcc1-0=14.2.0-19",
          "libcom-err2=1.47.2-3+b12",
          "libconfig-inifiles-perl=3.000003-3+deb13u1",
          "libcrypt-dev=1:4.4.38-1",
          "libcrypt1=1:4.4.38-1",
          "libctf-nobfd0=2.44-3",
          "libctf0=2.44-3",
          "libcurl3t64-gnutls=8.14.1-2+deb13u5",
          "libcurl4-openssl-dev=8.14.1-2+deb13u5",
          "libcurl4t64=8.14.1-2+deb13u5",
          "libdb5.3t64=5.3.28+dfsg2-9",
          "libdebconfclient0=0.280",
          "libdpkg-perl=1.22.22",
          "libedit2=3.1-20250104-1",
          "liberror-perl=0.17030-1",
          "libevent-2.1-7t64=2.1.13-stable-1~deb13u1",
          "libexpat1=2.8.3-1~deb13u1",
          "libffi8=3.4.8-2",
          "libfreetype-dev=2.13.3+dfsg-1+deb13u1",
          "libfreetype6=2.13.3+dfsg-1+deb13u1",
          "libgcc-14-dev=14.2.0-19",
          "libgcc-s1=14.2.0-19",
          "libgdbm-compat4t64=1.24-2",
          "libgdbm6t64=1.24-2",
          "libgmp-dev=2:6.3.0+dfsg-3",
          "libgmp10=2:6.3.0+dfsg-3",
          "libgmpxx4ldbl=2:6.3.0+dfsg-3",
          "libgnutls-dane0t64=3.8.9-3+deb13u4",
          "libgnutls-openssl27t64=3.8.9-3+deb13u4",
          "libgnutls28-dev=3.8.9-3+deb13u4",
          "libgnutls30t64=3.8.9-3+deb13u4",
          "libgomp1=14.2.0-19",
          "libgprofng0=2.44-3",
          "libgssapi-krb5-2=1.21.3-5+deb13u1",
          "libgssrpc4t64=1.21.3-5+deb13u1",
          "libhogweed6t64=3.10.1-1",
          "libhwasan0=14.2.0-19",
          "libicu-dev=76.1-4",
          "libicu76=76.1-4",
          "libidn2-0=2.3.8-2",
          "libidn2-dev=2.3.8-2",
          "libisl23=0.27-1",
          "libitm1=14.2.0-19",
          "libjansson4=2.14-2+b3",
          "libjpeg62-turbo=1:2.1.5-4",
          "libjpeg62-turbo-dev=1:2.1.5-4",
          "libjq1=1.7.1-6+deb13u4",
          "libk5crypto3=1.21.3-5+deb13u1",
          "libkadm5clnt-mit12=1.21.3-5+deb13u1",
          "libkadm5srv-mit12=1.21.3-5+deb13u1",
          "libkdb5-10t64=1.21.3-5+deb13u1",
          "libkeyutils1=1.6.3-6",
          "libkrb5-3=1.21.3-5+deb13u1",
          "libkrb5-dev=1.21.3-5+deb13u1",
          "libkrb5support0=1.21.3-5+deb13u1",
          "liblastlog2-2=2.41.5-0+deb13u1",
          "libldap-dev=2.6.10+dfsg-1",
          "libldap2=2.6.10+dfsg-1",
          "liblsan0=14.2.0-19",
          "liblz4-1=1.10.0-4",
          "liblzma5=5.8.1-1+deb13u2",
          "libmagic-mgc=1:5.46-5",
          "libmagic1t64=1:5.46-5",
          "libmariadb3=1:11.8.6-0+deb13u1",
          "libmd0=1.1.0-2+b1",
          "libmount1=2.41.5-0+deb13u1",
          "libmpc3=1.3.1-1+b3",
          "libmpfr6=4.2.2-1",
          "libncurses6=6.5+20250216-2",
          "libncursesw6=6.5+20250216-2",
          "libnettle8t64=3.10.1-1",
          "libnghttp2-14=1.64.0-1.1+deb13u1",
          "libnghttp2-dev=1.64.0-1.1+deb13u1",
          "libnghttp3-9=1.8.0-1",
          "libnghttp3-dev=1.8.0-1",
          "libngtcp2-16=1.11.0-1+deb13u1",
          "libngtcp2-crypto-gnutls8=1.11.0-1+deb13u1",
          "libonig-dev=6.9.9-1+b1",
          "libonig5=6.9.9-1+b1",
          "libp11-kit-dev=0.25.5-3",
          "libp11-kit0=0.25.5-3",
          "libpam-modules=1.7.0-5",
          "libpam-modules-bin=1.7.0-5",
          "libpam-runtime=1.7.0-5",
          "libpam0g=1.7.0-5",